{"$schema":"https://json-schema.org/draft/2020-12/schema","type":"object","additionalProperties":false,"required":["schema_version","order_id","hypothesis_id","evidence_tier","edge_claim","synthetic_metadata_sha256","schedule","validation_seal","access_counters"],"properties":{"schema_version":{"const":"lily_l3_b714_date_only_schedule_attestation_v4"},"order_id":{"const":"B7.14R"},"hypothesis_id":{"const":"L-3"},"evidence_tier":{"const":"E0"},"edge_claim":{"const":"none"},"synthetic_metadata_sha256":{"type":"string","pattern":"^[0-9a-f]{64}$"},"schedule":{"type":"object"},"validation_seal":{"const":{"status":"sealed_not_accessed","accessed":false}},"access_counters":{"type":"object"}}}
