{"access_counters":{"allowed_string_decode_count":830,"date_metadata_inspection_count":200,"ledger_row_count":0,"real_container_access_count":0,"research_decision_count":0,"return_decode_count":0,"session_date_values_decoded_count":200,"skipped_return_number_lexeme_count":200,"skipped_timestamp_string_lexeme_count":201,"validation_access_count":0},"edge_claim":"none","evidence_tier":"E0","hypothesis_id":"L-3","order_id":"B7.14R","schedule":{"common_sessions":["2007-02-05","2007-02-06","2007-02-07","2007-02-08","2007-02-09","2007-02-12","2007-02-13","2007-02-14","2007-02-15","2007-02-16","2007-02-19","2007-02-20","2007-02-21","2007-02-22","2007-02-23","2007-02-26","2007-02-27","2007-02-28","2007-03-01","2007-03-02","2007-03-05","2007-03-06","2007-03-07","2007-03-08","2007-03-09"],"date_evidence_sha256":"65fb046aff4746750cbc1a611b329e00b24afb5f98863f801ec4de766224d56f","execution_dates":["2007-02-12"],"selected_decision_dates":["2007-02-09"],"t_plus_20_dates":["2007-03-09"]},"schema_version":"lily_l3_b714_date_only_schedule_attestation_v4","synthetic_metadata_sha256":"f00f979700a5b76f35ed97deb644bb59588edb6191d72dc47c0c22dcd1572a4e","validation_seal":{"accessed":false,"status":"sealed_not_accessed"}}
